{
  "id": "item.proof_token",
  "kind": "item",
  "displayName": "Proof Token",
  "displayNameKey": "item.proof_token.name",
  "descriptionKey": "item.proof_token.desc",
  "visualId": "visual.item_proof_token",
  "iconAssetId": "visual.item_proof_token",
  "worldAssetId": "visual.item_proof_token",
  "category": "quest",
  "rarity": "rarity.common",
  "questItem": true,
  "equippable": false,
  "droppable": true,
  "tags": ["quest"],
  "maxStack": 20,
  "tradeable": true,
  "destroyable": false,
  "uniquePolicy": "none",
  "classRequirements": [],
  "levelRequirement": 0,
  "attackBonus": 0,
  "statModifiers": [],
  "sellValue": 0,
  "schemaVersion": 1
}
