{
  "id": "item.iron_sword",
  "kind": "item",
  "displayName": "Iron Sword",
  "displayNameKey": "item.iron_sword.name",
  "descriptionKey": "item.iron_sword.desc",
  "visualId": "visual.item_iron_sword",
  "iconAssetId": "visual.item_iron_sword",
  "worldAssetId": "visual.item_iron_sword",
  "category": "weapon",
  "rarity": "rarity.uncommon",
  "questItem": false,
  "equippable": true,
  "droppable": true,
  "tags": [],
  "maxStack": 1,
  "tradeable": true,
  "destroyable": true,
  "uniquePolicy": "none",
  "equipSlot": "main_hand",
  "equipmentSlotTags": ["main_hand"],
  "classRequirements": [],
  "levelRequirement": 0,
  "attackBonus": 5,
  "statModifiers": [{ "statId": "test.stat.attack", "amount": 5 }],
  "sellValue": 8,
  "schemaVersion": 1
}
